{
  "schema_version": "v1",
  "event_id": "16161616-1616-4161-8161-161616161616",
  "event_version": "1.0.0",
  "event_name": "evidence.gap.requested",
  "direction": "inbound",
  "occurred_at": "2026-07-18T18:00:00Z",
  "tenant_id": "11111111-1111-4111-8111-111111111111",
  "request_id": "22222222-2222-4222-8222-222222222222",
  "actor_credential_id": "33333333-3333-4333-8333-333333333333",
  "audit_id": "44444444-4444-4444-8444-444444444444",
  "subject_id": "campaign-antigua-2027",
  "payload_type": "evidence_gap_request",
  "payload": {
    "schema_version": "v1",
    "direction": "inbound",
    "product_boundary": "evidence_gap_request_only",
    "gap_request_id": "14141414-1414-4141-8141-141414141414",
    "request_id": "22222222-2222-4222-8222-222222222222",
    "tenant_id": "11111111-1111-4111-8111-111111111111",
    "subject": "Procedimiento municipal para un proyecto comunitario de agua",
    "missing_document": "Manual oficial vigente de agua y saneamiento de Antigua Guatemala",
    "reason": "Se requiere una fuente local para validar responsables y pasos.",
    "priority": "high",
    "campaign_reference": "campaign-antigua-2027",
    "jurisdiction": "Municipio de La Antigua Guatemala, Sacatepéquez, Guatemala",
    "provenance": {
      "source_product": "os_electoral",
      "generated_by": "integration_client",
      "created_at": "2026-07-18T18:00:00Z",
      "source_refs": [
        "campaign-antigua-2027"
      ],
      "credential_id": "33333333-3333-4333-8333-333333333333",
      "audit_id": "44444444-4444-4444-8444-444444444444"
    }
  },
  "provenance": {
    "source_product": "os_electoral",
    "generated_by": "integration_client",
    "created_at": "2026-07-18T18:00:00Z",
    "source_refs": [
      "campaign-antigua-2027"
    ],
    "credential_id": "33333333-3333-4333-8333-333333333333",
    "audit_id": "44444444-4444-4444-8444-444444444444"
  }
}
